{
  "validationId": "val-1781951273455",
  "tenantId": "tenant-contoso-health",
  "artifactId": "identity-mfa-requirement-demo",
  "requirementId": "identity-mfa-requirement",
  "templateId": "identity-access-control",
  "layer2Ref": {
    "outputType": "bicep",
    "outputPath": "adpa/tenants/tenant-contoso-health/deployed/azure/identity-identity-mfa-requirement.bicep",
    "checksum": "abc",
    "cloudProvider": "azure"
  },
  "deployedRef": {
    "cloudProvider": "azure",
    "resourceIds": [
      "/subscriptions/sub-contoso-prod-001/providers/Microsoft.Authorization/policyAssignments/identity-mfa-enforcement"
    ],
    "deployRunId": "deploy-demo",
    "deployedAt": "2026-06-20T10:27:53.455Z"
  },
  "healthState": {
    "overall": "healthy",
    "structural": "passed",
    "compliance": "compliant",
    "operational": "healthy"
  },
  "controlResults": [
    {
      "controlId": "identity-mfa-enforcement",
      "expected": "MFA required",
      "observed": "Policy active",
      "status": "pass"
    }
  ],
  "validatedAt": "2026-06-20T10:27:53.457Z",
  "validatedBy": "test",
  "lineage": {
    "lineageId": "5d85ff5f-9d07-4e0d-aad1-effbbebc1596",
    "artifactLayer": "validation",
    "outputType": "bicep",
    "cloudProvider": "azure",
    "pillar": "identity",
    "upstream": {
      "entityIds": [],
      "telemetryEventIds": [],
      "requirementId": "identity-mfa-requirement",
      "artifactId": "identity-mfa-requirement-demo",
      "templateId": "identity-access-control",
      "definitionRefs": [],
      "layer2OutputPath": "adpa/tenants/tenant-contoso-health/deployed/azure/identity-identity-mfa-requirement.bicep"
    },
    "downstream": {},
    "tarCol": {},
    "actors": {
      "proposer": "test",
      "executor": "traceability-service",
      "systemId": "ict-governance-framework-api"
    },
    "integrity": {
      "contentChecksum": "13a1036094e2b1545cdd3ba1f9feeb66d1e4262ef942373c7e4b043b87955d34",
      "supersedes": null,
      "supersededBy": null
    },
    "recordedAt": "2026-06-20T10:27:53.457Z"
  },
  "rpasEvidence": {},
  "assetLoopBack": {
    "assetIds": [
      "/subscriptions/sub-contoso-prod-001/providers/Microsoft.Authorization/policyAssignments/identity-mfa-enforcement"
    ],
    "complianceMonitorIds": [
      "monitor-001-providers-Microsoft-Authorization-policyAssignments-identity-mfa-enforcement-1781951273460"
    ],
    "complianceStateApplied": "Compliant",
    "appliedAt": "2026-06-20T10:27:53.462Z"
  }
}
